{
  "$schema": "https://json-schema.org/draft/2020-12/schema",
  "$id": "https://local-pii.dev/schemas/policy/redaction-policy/1.0.0",
  "title": "Redaction policy",
  "description": "Declarative fail-closed transformation and verification policy with no executable content.",
  "schemaVersion": "1.0.0",
  "type": "object",
  "additionalProperties": false,
  "required": ["schemaVersion", "id", "version", "riskTier", "defaults", "entities", "verification", "limits"],
  "properties": {
    "schemaVersion": { "const": "1.0.0" },
    "id": { "type": "string", "pattern": "^[a-z][a-z0-9-]{2,63}$" },
    "version": { "$ref": "https://local-pii.dev/schemas/common/identifiers/1.0.0#/$defs/Semver" },
    "riskTier": { "enum": ["LOW", "MODERATE", "HIGH"] },
    "defaults": { "$ref": "#/$defs/entityRule" },
    "entities": {
      "type": "object", "minProperties": 1, "maxProperties": 24,
      "propertyNames": { "$ref": "https://local-pii.dev/schemas/common/entity-type/1.0.0" },
      "additionalProperties": { "$ref": "#/$defs/entityRule" }
    },
    "verification": {
      "type": "object", "additionalProperties": false, "required": ["profile", "blockOnWarnings"],
      "properties": {
        "profile": { "type": "string", "minLength": 1, "maxLength": 64 },
        "formatProfiles": {
          "description": "Verification profiles this policy requires for named formats instead of the default profile. A container format whose output cannot be verified by rescanning canonical text alone names its own profile here rather than silently borrowing one that never reopens the package.",
          "type": "object", "additionalProperties": false, "minProperties": 1, "maxProperties": 32,
          "propertyNames": { "type": "string", "pattern": "^[a-z][a-z0-9-]{1,31}$" },
          "patternProperties": { "^[a-z][a-z0-9-]{1,31}$": { "type": "string", "minLength": 1, "maxLength": 64 } }
        },
        "blockOnWarnings": { "type": "boolean" }
      }
    },
    "limits": {
      "type": "object", "additionalProperties": false, "required": ["maximumInputBytes"],
      "properties": { "maximumInputBytes": { "type": "integer", "minimum": 1, "maximum": 1073741824 } }
    }
  },
  "$defs": {
    "entityRule": {
      "type": "object", "additionalProperties": false, "required": ["action", "minimumConfidence", "uncertainBehavior"],
      "properties": {
        "action": { "enum": ["REDACT", "TYPED_LABEL", "MASK", "PSEUDONYM", "HASHED_LABEL", "KEEP", "REQUIRE_REVIEW", "BLOCK"] },
        "minimumConfidence": { "type": "number", "minimum": 0, "maximum": 1 },
        "reviewBelow": { "type": "number", "minimum": 0, "maximum": 1 },
        "uncertainBehavior": { "enum": ["REQUIRE_REVIEW", "BLOCK", "KEEP"] },
        "residualBehavior": { "enum": ["BLOCK", "WARN"] },
        "requiredDetectors": { "type": "array", "uniqueItems": true, "maxItems": 32, "items": { "type": "string", "minLength": 1, "maxLength": 100 } },
        "requiredDetectorKinds": { "type": "array", "uniqueItems": true, "items": { "enum": ["REGEX", "CHECKSUM", "STRUCTURED", "DICTIONARY", "MODEL"] } }
      }
    }
  },
  "examples": [{
    "schemaVersion": "1.0.0", "id": "development-labels", "version": "0.1.0", "riskTier": "LOW",
    "defaults": { "action": "TYPED_LABEL", "minimumConfidence": 0.8, "uncertainBehavior": "REQUIRE_REVIEW" },
    "entities": { "EMAIL": { "action": "TYPED_LABEL", "minimumConfidence": 0.95, "uncertainBehavior": "REQUIRE_REVIEW", "requiredDetectors": ["email-pattern"] } },
    "verification": { "profile": "text-rescan-v1", "formatProfiles": { "docx": "docx-redact-v1" }, "blockOnWarnings": true }, "limits": { "maximumInputBytes": 104857600 }
  }]
}
